[
  {
    "name": "Olimex ESP32-Gateway Rev G",
    "chip": "ESP32",
    "flashBaud": 460800,
    "firmwares": [
      "esp32",
      "esp32-eth"
    ],
    "image": "assets/deviceModels/esp32-olimex-gateway.png",
    "description": "Ethernet takes 0, 17, 18, 19, 21, 22, 25, 26 and 27, so LED outputs go on 4, 13 and 14 (the microSD's pins, free while no SD card is used), 16, 32 or 33.",
    "url": "https://www.olimex.com/Products/IoT/ESP32/ESP32-GATEWAY/open-source-hardware",
    "supported": [
      "LEDs",
      "WiFi",
      "Ethernet",
      "Buttons"
    ],
    "planned": [
      "SD card"
    ],
    "state": {
      "System": {
        "deviceModel": "Olimex ESP32-Gateway Rev G"
      },
      "Drivers": {
        "$patch": "replace",
        "RmtLed": {
          "type": "RmtLedDriver"
        }
      },
      "Network": {
        "$patch": "replace",
        "Ethernet": {
          "type": "EthernetModule",
          "ethBoard": "Classic RMII"
        }
      },
      "Services": {
        "$patch": "replace",
        "Buttons": {
          "type": "ButtonService",
          "buttons": [
            {
              "pin": 34,
              "activeLow": true,
              "target": "Control.switch1",
              "kind": "toggle"
            }
          ]
        }
      }
    }
  },
  {
    "name": "LOLIN D32",
    "chip": "ESP32",
    "firmwares": [
      "esp32"
    ],
    "flashBaud": 460800,
    "image": "assets/deviceModels/esp32-lolin-d32.jpg",
    "url": "https://www.wemos.cc/en/latest/d32/d32.html",
    "supported": [
      "LEDs",
      "WiFi"
    ],
    "planned": [
      "Battery"
    ],
    "state": {
      "System": {
        "deviceModel": "LOLIN D32"
      },
      "Drivers": {
        "$patch": "replace",
        "RmtLed": {
          "type": "RmtLedDriver"
        }
      }
    }
  },
  {
    "name": "Generic ESP32 Dev",
    "chip": "ESP32",
    "firmwares": [
      "esp32"
    ],
    "image": "assets/deviceModels/esp32-generic-dev.jpg",
    "supported": [
      "LEDs",
      "WiFi"
    ],
    "planned": [],
    "state": {
      "System": {
        "deviceModel": "Generic ESP32 Dev"
      },
      "Drivers": {
        "$patch": "replace",
        "RmtLed": {
          "type": "RmtLedDriver"
        }
      }
    }
  },
  {
    "name": "ESP32-WROVER",
    "chip": "ESP32",
    "firmwares": [
      "esp32-wrover"
    ],
    "url": "https://www.espboards.dev/esp32/esp32wrover/",
    "image": "assets/deviceModels/esp32-wrover.jpg",
    "supported": [
      "LEDs",
      "WiFi"
    ],
    "planned": [],
    "state": {
      "System": {
        "deviceModel": "ESP32-WROVER"
      },
      "Drivers": {
        "$patch": "replace",
        "RmtLed": {
          "type": "RmtLedDriver",
          "pins": "2"
        }
      }
    }
  },
  {
    "name": "QuinLED Dig-2-Go",
    "chip": "ESP32",
    "firmwares": [
      "esp32"
    ],
    "image": "assets/deviceModels/esp32-quinled-dig-2-go.jpg",
    "description": "Relay on 12 is an on-board switch in the LED power line, so the LEDs light only while it is closed.",
    "url": "https://quinled.info/quinled-dig2go/",
    "supported": [
      "LEDs",
      "WiFi",
      "Buttons",
      "Relay"
    ],
    "planned": [
      "IR",
      "Microphone"
    ],
    "state": {
      "System": {
        "deviceModel": "QuinLED Dig-2-Go"
      },
      "Drivers": {
        "$patch": "replace",
        "relayPins": "12",
        "RmtLed": {
          "type": "RmtLedDriver",
          "pins": "16",
          "fixture": "GRBW"
        }
      },
      "Services": {
        "$patch": "replace",
        "Buttons": {
          "type": "ButtonService",
          "buttons": [
            {
              "pin": 0,
              "activeLow": true,
              "target": "Control.switch1",
              "kind": "toggle"
            }
          ]
        }
      }
    }
  },
  {
    "name": "QuinLED Dig-Next-2",
    "chip": "ESP32",
    "firmwares": [
      "esp32-pico"
    ],
    "image": "assets/deviceModels/esp32-pico-quinled-dig-next-2.jpg",
    "description": "Relays on 20, 21 and 22 are on-board switches, one per fused power output; 5 triggers an optional external relay board.",
    "url": "https://quinled.info/dig-next-2/",
    "supported": [
      "LEDs",
      "WiFi",
      "Audio",
      "Buttons",
      "Relay"
    ],
    "planned": [],
    "flashBaud": 460800,
    "state": {
      "System": {
        "deviceModel": "QuinLED Dig-Next-2"
      },
      "Drivers": {
        "$patch": "replace",
        "relayPins": "5,20,21,22",
        "RmtLed": {
          "type": "RmtLedDriver",
          "pins": "2,4"
        }
      },
      "Services": {
        "$patch": "replace",
        "Audio": {
          "type": "AudioService",
          "mode": 2,
          "micMode": 1,
          "wsPin": 8,
          "sdPin": 7
        },
        "Buttons": {
          "type": "ButtonService",
          "buttons": [
            {
              "pin": 34,
              "activeLow": true,
              "target": "Control.switch1",
              "kind": "toggle"
            },
            {
              "pin": 35,
              "activeLow": true
            }
          ]
        }
      }
    }
  },
  {
    "name": "QuinLED Dig-Uno V3",
    "chip": "ESP32",
    "firmwares": [
      "esp32"
    ],
    "image": "assets/deviceModels/esp32-quinled-dig-uno-v3.jpg",
    "url": "https://quinled.info/pre-assembled-quinled-dig-uno/",
    "supported": [
      "LEDs",
      "WiFi",
      "Ethernet"
    ],
    "planned": [
      "Temperature"
    ],
    "state": {
      "System": {
        "deviceModel": "QuinLED Dig-Uno V3"
      },
      "Drivers": {
        "$patch": "replace",
        "RmtLed": {
          "type": "RmtLedDriver",
          "pins": "16,3"
        }
      }
    }
  },
  {
    "name": "QuinLED Dig-Quad V3",
    "chip": "ESP32",
    "firmwares": [
      "esp32"
    ],
    "image": "assets/deviceModels/esp32-quinled-dig-quad-v3.jpg",
    "description": "Relay on 15 is a 5 V trigger for an optional external relay, on pre-assembled boards.",
    "url": "https://quinled.info/pre-assembled-quinled-dig-quad/",
    "supported": [
      "LEDs",
      "WiFi",
      "Ethernet",
      "Buttons",
      "Relay"
    ],
    "planned": [
      "Temperature"
    ],
    "state": {
      "System": {
        "deviceModel": "QuinLED Dig-Quad V3"
      },
      "Drivers": {
        "$patch": "replace",
        "RmtLed": {
          "type": "RmtLedDriver",
          "pins": "16,3,1,4"
        },
        "relayPins": "15"
      },
      "Services": {
        "$patch": "replace",
        "Buttons": {
          "type": "ButtonService",
          "buttons": [
            {
              "pin": 0,
              "activeLow": true,
              "target": "Control.switch1",
              "kind": "toggle"
            }
          ]
        }
      }
    }
  },
  {
    "name": "QuinLED An-DecaPenta",
    "chip": "ESP32",
    "firmwares": [
      "esp32"
    ],
    "flashBaud": 460800,
    "image": "assets/deviceModels/esp32-quinled-an-decapenta.jpg",
    "url": "https://quinled.info/quinled-an-penta-deca/",
    "supported": [
      "LEDs",
      "WiFi",
      "Buttons",
      "I2C"
    ],
    "planned": [],
    "state": {
      "System": {
        "deviceModel": "QuinLED An-DecaPenta",
        "I2cBus": {
          "type": "I2cBusModule",
          "sda": 15,
          "scl": 16
        }
      },
      "Drivers": {
        "$patch": "replace",
        "relayPins": "",
        "PwmLight": {
          "type": "PwmLightDriver",
          "fixture": "RGBCCT",
          "pins": "27,26,25,22,23,21,19,18,14,17,13,12,5,2,4"
        }
      },
      "Network": {
        "$patch": "replace",
        "Ethernet": {
          "type": "EthernetModule",
          "ethBoard": "Custom",
          "ethType": 0
        }
      },
      "Layouts": {
        "$patch": "replace",
        "Grid": {
          "type": "GridLayout",
          "width": 1,
          "height": 3
        }
      },
      "Services": {
        "$patch": "replace",
        "Buttons": {
          "type": "ButtonService",
          "buttons": [
            {
              "pin": 36,
              "activeLow": true,
              "target": "Control.switch1",
              "kind": "toggle"
            },
            {
              "pin": 39,
              "activeLow": true
            },
            {
              "pin": 34,
              "activeLow": true
            },
            {
              "pin": 33,
              "activeLow": true
            }
          ]
        }
      }
    }
  },
  {
    "name": "QuinLED An-Penta-Plus",
    "chip": "ESP32",
    "firmwares": [
      "esp32"
    ],
    "image": "assets/deviceModels/esp32-quinled-an-penta-plus.jpg",
    "description": "Relay on 13 cuts the power of the addressable-LED output.",
    "url": "https://quinled.info/quinled-an-penta-plus/",
    "supported": [
      "LEDs",
      "WiFi",
      "Ethernet",
      "Buttons",
      "I2C",
      "Relay"
    ],
    "planned": [],
    "state": {
      "System": {
        "deviceModel": "QuinLED An-Penta-Plus",
        "I2cBus": {
          "type": "I2cBusModule",
          "sda": 15,
          "scl": 16
        }
      },
      "Drivers": {
        "$patch": "replace",
        "relayPins": "13",
        "PwmLight": {
          "type": "PwmLightDriver",
          "fixture": "RGBCCT",
          "pins": "2,4,12,33,32"
        },
        "RmtLed": {
          "type": "RmtLedDriver",
          "pins": "5"
        }
      },
      "Network": {
        "$patch": "replace",
        "Ethernet": {
          "type": "EthernetModule",
          "ethBoard": "Classic RMII (no reset)"
        }
      },
      "Services": {
        "$patch": "replace",
        "Buttons": {
          "type": "ButtonService",
          "buttons": [
            {
              "pin": 36,
              "activeLow": true,
              "target": "Control.switch1",